state,abbr,slug,fee_schedule_short,fee_schedule_full,fee_schedule_agency,fee_schedule_url,pharmacy_basis,settlement_approval_agency_short,settlement_approval_agency_full,settlement_approval_quirk,cms_regional_office,quirk_1,quirk_2,quirk_3,metro_1,metro_2,metro_3,metro_4,metro_5,caselaw_citation,handwrite_recommended,verify_status,sources
Oregon,OR,oregon,Oregon WC Medical Fee Schedule (OAR 436-009),"Oregon Workers' Compensation Medical Fee Schedule, Oregon Administrative Rules Chapter 436 Division 009","Oregon Workers' Compensation Division (WCD), Department of Consumer and Business Services (DCBS)",https://wcd.oregon.gov/medical/pages/fee-schedules-forms.aspx,AWP-based per OAR 436-009-0090; non-compounding pharmacy at a scheduled percentage of AWP plus dispensing fee; compounding pharmacy at 83.5% of AWP per ingredient plus $10 compounding and dispensing fee; insurer uses a nationally published pricing guide (RED BOOK or Medi-Span),Workers' Compensation Board (WCB),Oregon Workers' Compensation Board,"Claim Disposition Agreements (CDAs) on accepted claims are reviewed and approved by the Workers' Compensation Board; the Board may reject a CDA if no bona fide dispute exists or if the proposed disposition is not reasonable, and workers retain a 30-day cooling-off period to request disapproval (waivable if represented by counsel).",Seattle,"Under Oregon's CDA structure, a worker retains medical benefits for life even after a CDA closes indemnity; the WCMSA must therefore account for continuing medical obligations that the insurer still owes, distinguishing what is allocated to the WCMSA from what remains an open carrier obligation.","Oregon operates as a no-fault system with a 60-day window for insurers to accept or deny claims; new or omitted conditions also trigger a separate 60-day decision cycle, so the accepted-condition scope can shift post-settlement and affect whether WCMSA projections are complete.","Oregon's 2025 billing code mandate requires use of AMA CPT 2025, HCPCS 2025, and ADA CDT 2025 codes on all bills; a WCMSA projecting future treatment must use current-year coding to ensure projected services map to reimbursable code sets.",Portland,Salem,Eugene,Gresham,Hillsboro,,N,PARTIALLY_CONFIRMED,"https://wcd.oregon.gov/medical/pages/fee-schedules-forms.aspx; https://oregon.public.law/rules/oar_436-009-0090; https://wcd.oregon.gov/worker/Pages/settlements.aspx"
Pennsylvania,PA,pennsylvania,PA WC Medical Fee Schedule,Pennsylvania Workers' Compensation Medical Fee Schedule (Part A and Part B) administered under 34 Pa. Code Chapter 127,"Pennsylvania Department of Labor and Industry, Bureau of Workers' Compensation, Health Care Services Review Division",https://www.pa.gov/agencies/dli/programs-services/workers-compensation/wc-health-care-services-review/wc-fee-schedule,110% of AWP per unit as of the date of dispensing (statutory basis under the PA Workers' Compensation Act); ongoing 2024-2025 litigation centers on whether NADAC or the Red Book AWP source applies; Bureau has moved toward NADAC with no dispensing fee added under that methodology,Workers' Compensation Judge (WCJ),"Pennsylvania Bureau of Workers' Compensation, Workers' Compensation Office of Adjudication — Workers' Compensation Judge","All Compromise and Release Agreements (C&R) under Section 449 of the Act require a hearing before a Workers' Compensation Judge who must find on the record that the injured worker understands the terms; neither party is bound until the WCJ signs the approval order.",Philadelphia,"Pennsylvania's Impairment Rating Evaluation (IRE) process, triggered after 104 weeks of total disability compensation, can convert a claimant's status from total to partial disability (capping benefits at 500 weeks) if the whole-body impairment rating is below 35%; WCMSA projections must account for whether IRE status has changed the benefit trajectory at settlement.","Pharmacy reimbursement is statutorily set at 110% of AWP, but the Commonwealth Court has questioned which AWP publication controls; a WCMSA projecting drug costs in Pennsylvania should note this pricing ambiguity and use the current Bureau-applied methodology at the time of allocation.","Pennsylvania's utilization review (UR) process under 34 Pa. Code Chapter 127 Subchapter C allows any party to challenge the reasonableness or necessity of treatment; a UR denial that has become final limits what future treatment is provable for WCMSA purposes, and any UR-denied treatment category should be addressed explicitly in the allocation rationale.",Philadelphia,Pittsburgh,Allentown,Erie,Reading,,N,CONFIRMED,"https://www.pa.gov/agencies/dli/programs-services/workers-compensation/wc-health-care-services-review/wc-fee-schedule; https://www.pacodeandbulletin.gov/Display/pacode?file=%2Fsecure%2Fpacode%2Fdata%2F034%2Fchapter127%2Fchap127toc.html; https://www.chartwelllaw.com/resources/pennsylvania-court-sets-aside-red-book-standard-for-pennsylvania-workers-compensation-prescriptions"
Rhode Island,RI,rhode-island,RI WC Medical Fee Schedule,Rhode Island Workers' Compensation Medical Fee Schedule (issued annually by the Director of the Department of Labor and Training),Rhode Island Department of Labor and Training (DLT),https://dlt.ri.gov/workers-compensation/insurers-and-adjusters/medical-fees-hospital-rates,"AWP up to 120%; if the pharmacy provides an invoice, reimbursement may be up to 120% of actual cost",RI Workers' Compensation Court,Rhode Island Workers' Compensation Court,"All settlements must be approved by a judge of the Workers' Compensation Court under R.I. Gen. Laws §§28-33-25 and 28-33-25.1; the court distinguishes between denial-and-dismissal settlements (pre-liability) and commutation settlements (post-liability), and commutation petitions must address whether future medical needs are funded.",Boston,"Rhode Island routes all workers' compensation disputes through a specialized judicial court (created in 1991); every contested element of a WCMSA-adjacent settlement, including medical allocation, is resolved through judicial proceedings before an appointed judge, which affects documentation standards and hearing timelines.","Injured workers retain the right to choose the first treating clinician; if the insurer has filed a Preferred Provider Network (PPN) with the Medical Advisory Board, any subsequent clinician change must be to a PPN-listed provider, making the treating clinician roster for WCMSA purposes dependent on which PPN, if any, applies to the claim.","Commutation petitions must disclose the Medicare set-aside amount to the court, so the WCMSA figure becomes part of the judicial record and is subject to the judge's review of whether the settlement adequately addresses future medical needs.",Providence,Warwick,Cranston,Pawtucket,East Providence,,N,CONFIRMED,"https://dlt.ri.gov/workers-compensation/insurers-and-adjusters/medical-fees-hospital-rates; https://www.courts.ri.gov/courts/workerscompensationcourt/Pages/default.aspx; https://law.justia.com/codes/rhode-island/title-28/chapter-28-33/"
South Carolina,SC,south-carolina,SCWCC Medical Services Provider Manual,South Carolina Workers' Compensation Commission Medical Services Provider Manual,"South Carolina Workers' Compensation Commission, Medical Services Division",https://www.wcc.sc.gov/medical-fee-schedules,"AWP of the original manufacturer's NDC as of the date of dispensing (sourced from Medi-Span or IBM Micromedex RED BOOK), plus a $5.00 dispensing fee for repackaged or relabeled drugs; compound drugs require prior authorization per dispensing; if AWP data is unavailable, WAC plus 20% substitutes; professional services conversion factor set at $52.00 effective March 2026",SCWCC,South Carolina Workers' Compensation Commission (Commissioner),"Workers' compensation settlements in South Carolina are approved by a Commissioner of the SCWCC; unrepresented claimants must attend a settlement conference with the Commissioner, who scrutinizes the agreement for fairness, while represented parties may proceed through a more streamlined filing process, with a $50 filing fee for all settlements.",Atlanta,"South Carolina employers control the initial selection of the authorized treating clinician; the SCWCC has discretion to authorize care from an unauthorized clinician in certain circumstances, but the treating record built under the employer-selected clinician is the primary evidentiary basis for projecting future medical need in a WCMSA.","The authorized treating clinician completes a Form 14B (Physician's Statement) at or near MMI, documenting diagnosis, work restrictions, and whether future medical care will be required; that form is a primary source document for WCMSA projections, and a projection that departs materially from the Form 14B findings requires clear supporting documentation.","South Carolina's medical fee schedule conversion factor is set by Commission vote and updated periodically; the 2026 conversion factor of $52.00 for professional services was approved at the March 2026 business meeting, so projected future costs must use the rate in effect at the time of the report, confirmed against the current Manual edition.",Charleston,Columbia,North Charleston,Mount Pleasant,Rock Hill,,N,CONFIRMED,"https://www.wcc.sc.gov/medical-fee-schedules; https://wcc.sc.gov/medical-services-faqs; https://www.mgclaw.com/news/south-carolina-workers-compensation-commission-revises-form-14b/"
South Dakota,SD,south-dakota,South Dakota WC Medical Fee Schedule,"South Dakota Workers' Compensation Medical Fee Schedule (Rule 47:03:05), based on Optum Relative Values for Physicians (RVP)","South Dakota Department of Labor and Regulation, Division of Labor and Management",https://dlr.sd.gov/workers_compensation/default.aspx,Usual and customary charge; South Dakota has no state-specific pharmacy fee schedule for workers' compensation and does not publish AWP-based reimbursement ceilings; no physician-dispensing guidance is published,SD Division of Labor and Management,"South Dakota Department of Labor and Regulation, Division of Labor and Management","Under SDCL 62-7-5, a settlement memorandum filed with the Division is deemed approved and enforceable if the Division does not object within twenty days; there is no judicial approval requirement, and the 20-day non-response window constitutes constructive approval.",Denver,"Full and final settlements that close medical benefits are available in South Dakota only when compensability is genuinely at issue; if liability is accepted, medical benefits generally remain open, and a WCMSA must reflect that future injury-related treatment may remain a carrier obligation unless compensability itself is in dispute.","South Dakota adopted the 2025 Optum Relative Values for Physicians (RVP) effective late 2025, updating from the 2020 edition; because the fee schedule is RVP-based, a clinician projecting future medical costs should confirm which RVP edition is in effect at the time of the WCMSA to use the correct relative value units.","South Dakota is a worker-choice state for treating clinician selection; the worker notifies the employer before or as soon as practicable after treatment, and changes of clinician require written insurer permission, so the treating clinician record and any referrals are worker-controlled and directly shape the future-care record on which the WCMSA is built.",Sioux Falls,Rapid City,Aberdeen,Brookings,Watertown,,N,CONFIRMED,"https://dlr.sd.gov/workers_compensation/default.aspx; https://sdlegislature.gov/Statutes/62-7; https://healthesystems.com/regulatory/south-dakota-approves-rulemaking-for-physician-fee-schedule/"
Tennessee,TN,tennessee,Tennessee WC Medical Fee Schedule,Tennessee Workers' Compensation Medical Fee Schedule (administered under Bureau of Workers' Compensation rules Chapter 0800-02-18),"Tennessee Department of Labor and Workforce Development, Bureau of Workers' Compensation",https://www.tn.gov/workforce/injuries-at-work/bureau-services/bureau-services/medical-fee-schedule.html,"AWP (current pricing as of date of service, updated per a 2025 rule amendment moving from monthly publication to current pricing); subject to ODG by MCG Health Drug Formulary (Chapter 0800-02-25); Y-status drugs dispensed without preauthorization; N-status drugs and all compounded, topical, and investigational drugs require prior approval; rate tables updated April 1 each year and obtained through FAIR Health","Bureau of Workers' Compensation, Court of Workers' Compensation Claims","Tennessee Bureau of Workers' Compensation, Court of Workers' Compensation Claims","A workers' compensation judge must review and approve or reject all settlements within three business days of receipt; the judge determines whether the employee is receiving substantially the benefits provided by the Tennessee Workers' Compensation Law, and if the claimant is unrepresented, the judge is statutorily required to fully inform the claimant of available benefits and procedural rights before approving.",Atlanta,"Tennessee's 2013 Workers' Compensation Reform Act (effective July 1 2014) transferred all claim jurisdiction from civil courts to an administrative Court of Workers' Compensation Claims; claims with injury dates before July 1 2014 remain in a separate pre-reform legal framework with different appeal paths, so the applicable procedural law governing a WCMSA settlement depends on the injury date.","Tennessee adopted the ODG pharmaceutical formulary as the state's mandatory drug formulary; N-status drugs in the ODG require preauthorization, and a WCMSA that projects N-status medications must document the carrier's prior approval or the clinician's plan to seek it, since post-settlement reimbursability of those drugs at Tennessee fee schedule rates is not automatic.","Tennessee Bureau rules explicitly state that the Bureau does not regulate WCMSAs and cannot assist with price disputes after medical benefits are closed; a WCMSA priced at Tennessee fee schedule rates will not be enforced by the Bureau after settlement, and the set-aside funds become the claimant's responsibility to administer against Medicare's requirements independently.",Nashville,Memphis,Knoxville,Chattanooga,Clarksville,,N,CONFIRMED,"https://www.tn.gov/workforce/injuries-at-work/bureau-services/bureau-services/medical-fee-schedule.html; https://www.tn.gov/workforce/injuries-at-work/bureau-services/bureau-services/medical-programs-redirect/medical-treatment-guidelines/drug-formulary.html; https://www.tn.gov/workforce/injuries-at-work/bureau-services/bureau-services/court-of-wc-claims/settlement-approval-process.html"
Texas,TX,texas,DWC Medical Fee Guidelines,Texas Division of Workers' Compensation Medical Fee Guidelines (28 TAC Chapter 134),"Texas Department of Insurance, Division of Workers' Compensation (DWC)",https://www.tdi.texas.gov/wc/fee/index.html,"AWP × 1.25 per unit plus $4.00 dispensing fee per prescription for generics; closed formulary based on ODG Appendix A; drugs with ""N"" (not recommended) status require preauthorization; generic substitution required when available",DWC,"Texas Department of Insurance, Division of Workers' Compensation","Disputes proceed through a Benefit Review Conference before an ALJ contested case hearing; settlement is executed on DWC Form-25 and must be signed by all parties and submitted to the DWC field office for approval.",Dallas,"Texas's closed pharmacy formulary, governed by 28 TAC § 134.530 and the ODG Appendix A ""N"" drug list, requires that every drug projected in a WCMSA be evaluated against current formulary status; N-status drugs require preauthorization documentation for the projection to be defensible.","Approximately 28-30% of Texas private employers opt out of the WC system as non-subscribers; non-subscriber injury claims are tort actions outside the DWC system, and WCMSAs apply only to settlements of claims covered by actual DWC workers' compensation coverage.","DWC conversion factors are adjusted annually based on the Medicare Economic Index; the 2025 office-setting surgery conversion factor is $70.18, and WCMSA projections for TX use DWC conversion factors as the cost basis.",Houston,San Antonio,Dallas,Austin,Fort Worth,,Y,CONFIRMED,"https://www.tdi.texas.gov/wc/fee/index.html; https://www.tdi.texas.gov/wc/pharmacy/pharmacy-closed-formulary.html; https://www.tdi.texas.gov/wc/fee/conversionfactors.html"
Utah,UT,utah,Utah Medical Fee Standard,"Utah Medical Fee Standard (Utah Admin. Code R612-300), adopted by the Utah Labor Commission with approval of the Workers' Compensation Advisory Council","Utah Labor Commission, Division of Industrial Accidents",https://laborcommission.utah.gov/divisions/industrial-accidents/medical-providers/,AWP for the underlying medication as identified by its original labeler NDC; if AWP ceases to be published substitute WAC plus 20%; physician dispensing is largely prohibited,Utah Labor Commission ALJ,"Utah Labor Commission, Division of Adjudication, Administrative Law Judge","All settlements require Labor Commission approval through an ALJ; Utah ALJs routinely require a written explanation of how Medicare's interest is addressed before approving any full and final settlement, making WCMSA documentation a practical prerequisite to settlement approval even though Utah law does not independently mandate it.",Denver,"Utah's fee standard is based on the CMS RBRVS with conversion factors set by the Workers' Compensation Advisory Council (WCAC); the WCAC-approved rate differs from the CMS Medicare rate, so a WCMSA that uses Medicare pricing as a proxy may understate or overstate allowable charges depending on the procedure.","Medical benefits are lifetime for injuries on or after May 1 2007; for older injuries (July 1 1988 through April 30 2007) the worker must have billed the carrier at least once every three years to preserve ongoing eligibility, so the benefit duration on the WCMSA horizon is injury-date dependent and should be confirmed at claim review.","Utah Senate Bill 190 (effective May 7 2025) prohibits health care providers from balance billing for workers' compensation claims and expands the Labor Commission's authority over provider fees; this constraint sets a ceiling on what providers may collect and limits the billing basis available for future-cost projection.",Salt Lake City,West Valley City,Provo,West Jordan,Orem,,N,CONFIRMED,"https://laborcommission.utah.gov/divisions/industrial-accidents/medical-providers/; https://laborcommission.utah.gov/wp-content/uploads/2025-Medical-Fee-Schedule-3.pdf; https://le.utah.gov/~2025/bills/static/SB0190.html"
Vermont,VT,vermont,Vermont Rule 40 Medical Fee Schedule,Workers' Compensation Medical Fee Schedule Rule 40.000,Vermont Department of Labor,https://labor.vermont.gov/rule-40-vermonts-medical-fee-schedule,AWP (per Red Book or equivalent) plus $3.15 dispensing fee capped at the provider's actual charge,Vermont Department of Labor,"Vermont Department of Labor, Workers' Compensation Division","Compromise settlements (Form 16) require Commissioner approval; approval is granted only when the agreement is in the employee's best interest or when there is a genuine dispute, and the Division must review fund distribution before the settlement becomes binding.",Boston,"A Form 22 Agreement for Permanent Partial Disability closes indemnity liability but leaves the medical claim open by operation of Vermont law; the employer and carrier remain obligated to pay for future work-related medical care even after a PPD settlement, so the WCMSA projection applies only to settlements that include a specific medical compromise under a separate Form 16.","Vermont's fee schedule (Rule 40) uses an RBRVS-adjacent methodology for professional services; WCMSA projections for Vermont claimants must be priced against Rule 40 rates, which are updated periodically by the Department of Labor and may not track Medicare fee schedule movements on the same schedule.","Vermont has no independent utilization review or treatment guideline framework equivalent to some larger states; treatment disputes go to the Commissioner through an expedited hearing process, and an unresolved treatment dispute at settlement can complicate defining the ""reasonably probable future treatment"" scope for a WCMSA.",Burlington,South Burlington,Rutland,Essex Junction,Colchester,,N,PARTIALLY_CONFIRMED,"https://labor.vermont.gov/rule-40-vermonts-medical-fee-schedule; https://labor.vermont.gov/sites/labor/files/doc_library/rule40.pdf; https://labor.vermont.gov/document/form-16-settlement-agreement-rev-7-14"
Virginia,VA,virginia,VWC Medical Fee Schedules,Virginia Workers' Compensation Medical Fee Schedules (biennial; current edition effective January 1 2026 through December 31 2027),"Virginia Workers' Compensation Commission, Medical Fee Services Department",https://workcomp.virginia.gov/content/virginia-medical-fee-schedules,Prescription drugs are excluded from the VWC Medical Fee Schedules; reimbursement is at the lesser of the provider's usual and customary charge or AWP minus 10% (no dispensing fee for certain drug types); physician-dispensed medications are capped at the AWP-based schedule rate for the original NDC; generic substitution is required under Va. Code § 65.2-603.1,Virginia Workers' Compensation Commission,"Virginia Workers' Compensation Commission, Judicial Division — Deputy Commissioner","Compromise settlement petitions are reviewed and approved by a VWC Deputy Commissioner, who must find the settlement serves the best interests of the claimant; the petition must include a statement on the claimant's Medicare status, and approval typically takes 60 to 90 days from filing.",Philadelphia,"Virginia requires the employer to provide a panel of at least three independent physicians; the claimant's selection from that panel establishes the authorized treating clinician, and any change thereafter requires carrier consent or a Commission order; the authorized treating clinician's records are the primary evidentiary basis for projecting future medical care in a WCMSA.","Prescription drugs fall outside the VWC fee schedule and are reimbursed on an AWP-minus basis; because pharmacy costs are not capped by the same schedule as facility or professional services, WCMSA drug allocations must be calculated separately using current AWP-based pricing.","The VWC updates its Medical Fee Schedules on a biennial cycle; the current 2026-2027 edition controls for that two-year window, and a WCMSA prepared near the end of a schedule period should confirm which edition applies to the projected treatment dates.",Virginia Beach,Norfolk,Chesapeake,Richmond,Newport News,,N,CONFIRMED,"https://workcomp.virginia.gov/content/virginia-medical-fee-schedules; https://workcomp.virginia.gov/medical-fee-services/2026-medical-fee-schedules; https://law.lis.virginia.gov/vacode/title65.2/chapter6/section65.2-605/"
Washington,WA,washington,Medical Aid Rules and Fee Schedules (MARFS),"Washington State Medical Aid Rules and Fee Schedules (MARFS), published annually by the Department of Labor and Industries under RCW Title 51",Washington State Department of Labor and Industries (L&I),https://www.lni.wa.gov/patient-care/billing-payments/fee-schedules-and-payment-policies/,L&I formulary using a subset of the Washington State Preferred Drug List (PDL) plus a wrap-around formulary; prescription drugs for initial state-fund claim visits covered regardless of formulary status; pharmacy-only schedule (does not apply to clinician-administered drugs in office),Board of Industrial Insurance Appeals (BIIA),Washington State Board of Industrial Insurance Appeals,"Claim Resolution Settlement Agreements (CRSAs) are drafted by L&I, circulated for signatures, then submitted to the BIIA for approval; any party may revoke consent within 30 days of approval before the settlement becomes final.",Seattle,"Washington is a monopolistic state-fund jurisdiction: L&I is the sole workers' compensation insurer for all non-self-insured employers, so all fee schedule rules, formulary decisions, and settlement processes run through a single state entity with no private carrier variation to account for in WCMSA projections.","CRSAs exchange all future L&I indemnity benefits for a lump sum or structured payment while leaving medical benefits open; self-insured employers use CRSAs more frequently, and the open-medical retention means the WCMSA allocation must be carefully delineated from continuing L&I medical obligations.","The 2025 MARFS (effective July 1 2025) include a dedicated Chapter 19 for pharmacy; L&I uses treatment guidelines and formulary status to determine drug coverage, so projected drugs in a WCMSA must be confirmed against the current formulary and L&I policy.",Seattle,Spokane,Tacoma,Vancouver,Bellevue,,Y,CONFIRMED,"https://www.lni.wa.gov/patient-care/billing-payments/fee-schedules-and-payment-policies/; https://www.lni.wa.gov/patient-care/billing-payments/marfsdocs/2025/2025MARFSChapter19.pdf"
