state,abbr,slug,fee_schedule_short,fee_schedule_full,fee_schedule_agency,fee_schedule_url,pharmacy_basis,settlement_approval_agency_short,settlement_approval_agency_full,settlement_approval_quirk,cms_regional_office,quirk_1,quirk_2,quirk_3,metro_1,metro_2,metro_3,metro_4,metro_5,caselaw_citation,handwrite_recommended,verify_status,sources
Missouri,MO,missouri,No published fee schedule,"Missouri has no published workers' compensation medical fee schedule; all charges must be fair and reasonable and may not exceed the provider's usual and customary charge to private-pay or private-insurance patients (Missouri Revised Statutes § 287.140)","Missouri Department of Labor and Industrial Relations, Division of Workers' Compensation (DWC)",https://labor.mo.gov/dwc,Usual and customary charge; no state WC pharmacy fee schedule; Missouri § 287.140 requires charges not exceed the provider's U&C rate for non-WC patients; no AWP formula or formulary,DWC ALJ,Missouri Division of Workers' Compensation Administrative Law Judge,"An ALJ must approve any settlement agreement; the standard is that the settlement is free of fraud or undue influence, the employee understands and voluntarily accepts the terms, and the agreement is within a reasonable range of value; the ALJ does not conduct an independent deep review of medical records.",Kansas City,"Missouri's active Second Injury Fund (SIF) compensates workers whose current injury combines with a pre-existing disability to produce greater combined disability; when a SIF claim is part of a settlement, future medical responsibility may be split between the employer's carrier and the Fund, and the WCMSA allocation must account for which entity is liable for which future care.","Missouri has no medical fee schedule, so WCMSA cost projections must be grounded in provider-level U&C charges or Medicare rates as a surrogate, with explicit documentation of the methodology used.","Medical fee disputes are resolved through an administrative process under 8 CSR 50-2.030; where a payer reduces a charge, the provider must submit an affidavit that fees are fair and reasonable, and the dispute process creates a record that may be relevant to contested future-care projections.",Kansas City,Saint Louis,Springfield,Columbia,Independence,,N,CONFIRMED,"https://revisor.mo.gov/main/OneSection.aspx?section=287.140; https://labor.mo.gov/dwc; https://labor.mo.gov/dwc/units/sif-unit"
Montana,MT,montana,Montana Workers' Compensation Fee Schedules,Montana Workers' Compensation Professional Fee Schedule and Montana Workers' Compensation Facility Fee Schedule (Administrative Rule 24.29.1534),"Montana Department of Labor and Industry, Employment Relations Division",https://erd.dli.mt.gov/work-comp-claims/medical-regulations/montana-work-comp-fee-schedules,AWP plus $5.00 dispensing fee for brand drugs; AWP plus $15.22 dispensing fee for generics; reimbursement capped at lesser of provider's usual and customary charge negotiated contract amount or fee schedule; reimbursement keyed to original labeler NDC,Montana DLI Employment Relations Division,"Montana Department of Labor and Industry, Employment Relations Division","Settlements and lump-sum conversions are subject to Employment Relations Division approval under MCA 39-71-741; the parties must first complete mandatory mediation through the DLI before any dispute may proceed to the Workers' Compensation Court, and the Court may review a departmental disapproval on petition.",Denver,"Montana requires insurers to certify with the state, and a certified Managed Care Organization (MCO) may be contracted to designate the treating clinician; once an injured worker enters an MCO, the worker cannot change clinicians without insurer approval, so the MCO-designated treating record is the primary source for future-care projections in a WCMSA.","The Montana Utilization and Treatment Guidelines (montanaguidelines.com) establish evidence-based treatment benchmarks; treatment falling within the guidelines does not require prior authorization, but anything outside requires authorization per ARM 24.29.1593, and a WCMSA must reflect whether projected future treatment is guideline-conforming.","Montana maintains a standalone Workers' Compensation Court (a court of record separate from the district court system) that reviews benefit disputes after mediation has failed; settlement projections must account for the possibility that the Court is the final arbiter of contested medical necessity questions.",Billings,Missoula,Great Falls,Bozeman,Butte,,N,CONFIRMED,"https://erd.dli.mt.gov/work-comp-claims/medical-regulations/montana-work-comp-fee-schedules; https://montanaguidelines.com/; https://courts.mt.gov/Courts/workers-comp/page"
Nebraska,NE,nebraska,Nebraska WC Court Medical Services Fee Schedule,"Nebraska Workers' Compensation Court Schedule of Fees for Medical Services (established under Neb. Rev. Stat. § 48-120; updated annually; current edition effective January 1 2025)",Nebraska Workers' Compensation Court,https://www.newcc.gov/service-providers/medical-providers/fee-schedules/medical-services-fee-schedule,AWP-based per the Court's published fee schedule (pharmacy reimbursement is included in the schedule adopted under § 48-120; no separate closed formulary; specific AWP discount or formula VERIFY directly from current schedule),Nebraska WC Court,Nebraska Workers' Compensation Court,"Lump sum settlement applications must be filed with the Court under Neb. Rev. Stat. § 48-139 and Court Rule 47; the application requires a signed and verified petition from all parties, supporting medical reports, and a proposed approval order; a compromise settlement requires a showing of genuine dispute; payment must occur within 30 days of approval.",Kansas City,"Nebraska workers' compensation is adjudicated by a specialized court (the Nebraska Workers' Compensation Court); single-judge panels handle initial hearings statewide, and appeals go directly to the Nebraska Court of Appeals.","The Nebraska WC Court fee schedule is reviewed at least biennially and updated annually effective January 1; it incorporates CMS RBRVS relative value units with Nebraska-specific conversion factors, so projected future costs follow the Court's schedule as the cost basis.","The Court's Legal section reviews every lump sum settlement application for adequacy and statutory compliance before a judge approves it, adding a substantive administrative review step that is separate from the judge's formal approval; incomplete applications are returned before the judge ever acts.",Omaha,Lincoln,Bellevue,Grand Island,Kearney,,N,PARTIALLY_CONFIRMED,"https://www.newcc.gov/service-providers/medical-providers/fee-schedules/medical-services-fee-schedule; https://nebraskalegislature.gov/laws/statutes.php?statute=48-120; https://www.newcc.gov/resources/court-forms-and-publications/rules-of-procedure/rule-47"
Nevada,NV,nevada,Nevada Medical Fee Schedule (NMFS),"Nevada Medical Fee Schedule, reviewed and revised annually by the Administrator of the Division of Industrial Relations, effective February 1 each year","Nevada Division of Industrial Relations (DIR), Department of Business and Industry",https://dir.nv.gov/WCS/Medical_Providers/,"AWP-based pending transition; Nevada adopted the ODG Drug Formulary (SB 317, signed June 2025) effective September 9 2025; full closed-formulary enforcement begins July 1 2027, with non-formulary coverage continuing until January 1 2028",DIR,Nevada Division of Industrial Relations,"Under NRS 616C.415, DIR must receive and approve stipulated settlement agreements; insurers must provide workers a written explanation of all settlement alternatives before any agreement is finalized.",San Francisco,"Nevada's newly adopted ODG Drug Formulary (SB 317, 2025) will restrict reimbursable medications for all workers' compensation claims; any WCMSA projecting drug costs beyond 2027 must account for formulary status of each projected drug, since non-formulary drugs will be denied reimbursement absent a successful appeal to the Hearings Division.","For permanent partial disability ratings at or below 30% of whole person impairment, the full award may be paid as a lump sum; above 30%, only up to 30% may be paid as a lump sum with the remainder in installments, which constrains settlement structure and affects when future medical obligations are transferred.","Nevada uses designated treating clinician panels (provider panels) with rules updated alongside the SB 317 formulary legislation; if a claimant is directed to treat within a panel, projected future treating clinicians in the WCMSA must reflect that panel structure.",Las Vegas,Henderson,Reno,North Las Vegas,Sparks,,N,PARTIALLY_CONFIRMED,"https://dir.nv.gov/WCS/Medical_Providers/; https://dir.nv.gov/uploadedFiles/dirnvgov/content/WCS/MedicalDocs/2025%20NV%20MFS%20and%20Memo.pdf; https://dir.nv.gov/WCS/MedicalDocs/TheODGDrugFormularyAdoption/"
New Hampshire,NH,new-hampshire,No published fee schedule,New Hampshire does not publish a workers' compensation medical fee schedule,New Hampshire Department of Labor (Workers' Compensation Division),https://www.dol.nh.gov/workers-compensation,No WC-specific pharmacy fee schedule; pharmacy reimbursement governed by usual and customary charge under RSA 281-A:23,NH Department of Labor,"New Hampshire Department of Labor, Workers' Compensation Division","All settlements where compensability has been admitted or ordered require Commissioner approval; a formal hearing is required before approval, and lump-sum settlements are generally approved only after twelve months of continuous disability.",Boston,"The absence of a published fee schedule means WCMSA projections for New Hampshire claimants cannot use a state-specific maximum allowable rate; instead, projections must use the provider's usual and customary charge or, where a managed care network contract applies, the negotiated rate, requiring verification of network participation for each projected provider.","New Hampshire operates a two-tier medical payment structure: managed care networks negotiate fees for participating clinicians, while providers outside those networks bill usual and customary charges that carriers may challenge as excessive under RSA 281-A:24; the applicable tier for a given claimant must be identified when projecting future treatment costs.","Medical costs in New Hampshire workers' compensation account for a high share of total claim costs (above the national average), which reflects the absence of fee-schedule price controls; this cost environment makes accurate WCMSA pricing more variable and carrier scrutiny of projections higher.",Manchester,Nashua,Concord,Derry,Dover,,N,PARTIALLY_CONFIRMED,"https://www.dol.nh.gov/workers-compensation; https://www.dol.nh.gov/workers-compensation/cost-containment; https://www.alfainternational.com/compendium/workers-compensation/new-hampshire/"
New Jersey,NJ,new-jersey,No published fee schedule,New Jersey workers' compensation medical services are reimbursed at reasonable and customary rates under N.J.S.A. 34:15-15,"New Jersey Division of Workers' Compensation, Department of Labor and Workforce Development",https://www.nj.gov/labor/workerscompensation/tools-resources/legal-information/,VERIFY (no WC-specific pharmacy fee schedule confirmed; likely usual and customary basis consistent with the absence of a medical fee schedule),NJ Division of Workers' Compensation,New Jersey Division of Workers' Compensation,"Settlements proceed as either a Section 20 dismissal (N.J.S.A. 34:15-20), which fully extinguishes future rights and requires a genuine disputed issue, or a Section 22 Order Approving Settlement, which assigns a disability percentage and preserves the right to reopen; a judge of compensation must approve both types.",New York,"The employer and carrier control the choice of authorized treating clinician under N.J.S.A. 34:15-15; treatment outside the authorized provider is not compensable except in emergencies, so the treating clinician roster that forms the WCMSA medical history is entirely employer-directed, which can affect the completeness and objectivity of the clinical record.","Because there is no published medical fee schedule, WCMSA projections for New Jersey claimants must use the provider's reasonable and customary charge; this can produce higher projected costs than in fee-schedule states and warrants explicit documentation of pricing methodology in the report.","Section 20 dismissals require a disputed issue of liability, causation, or jurisdiction; a WCMSA tied to a Section 20 settlement must clearly document the basis for dispute, because a settlement that looks like an accepted claim resolved for payment convenience may not qualify, affecting the legal posture of the MSA.",Newark,Jersey City,Paterson,Elizabeth,Edison,,N,PARTIALLY_CONFIRMED,"https://www.nj.gov/labor/workerscompensation/tools-resources/legal-information/; https://www.nj.gov/labor/workerscompensation/assets/PDFs/Forms/wc_law.pdf; https://www.law.cornell.edu/regulations/new-jersey/N-J-A-C-12-235-3-13"
New Mexico,NM,new-mexico,WCA Health Care Provider Fee Schedule,New Mexico Workers' Compensation Administration Health Care Provider Fee Schedule and Billing Instructions,New Mexico Workers' Compensation Administration (WCA),https://www.workerscomp.nm.gov/wp-content/uploads/2025/04/NewMexicoPFS2025.pdf,"AWP of the lowest-priced therapeutically equivalent drug (per unit, prorated from the ""100s each"" quantity as listed in a nationally recognized publication on the date of dispensing); no separate closed formulary",WCA,New Mexico Workers' Compensation Administration,"Lump sum settlement requires a hearing before a workers' compensation judge; the judge must find the agreement fair, equitable, and in substantial compliance with the Act, and must ensure unrepresented workers affirmatively understand that medical benefits cease permanently upon approval (NMSA §§ 52-5-12 and 52-5-13).",Dallas,"New Mexico policy disfavors lump sum settlement; the statute (§ 52-5-12) states it is in the best interest of injured workers to receive periodic benefits, so judges scrutinize lump sum proposals more closely than in most states.","Mediation is mandatory before a formal hearing can proceed; the WCA mediator issues a Recommended Resolution that binds both parties if neither rejects it, so many cases resolve at mediation without a full trial record, affecting the depth of medical documentation available.","The WCA fee schedule is updated annually by Director's Order and is not RBRVS-identical to Medicare; conversion to projected future costs uses the current WCA schedule rates as the cost basis.",Albuquerque,Las Cruces,Rio Rancho,Santa Fe,Roswell,,N,CONFIRMED,"https://www.workerscomp.nm.gov/wp-content/uploads/2025/04/NewMexicoPFS2025.pdf; https://www.workerscomp.nm.gov/; https://law.justia.com/codes/new-mexico/chapter-52/article-5/section-52-5-12/"
New York,NY,new-york,Official NY WC Medical Fee Schedule,Official New York Workers' Compensation Medical Fee Schedule (incorporating the New York State Workers' Compensation Drug Formulary for pharmaceuticals),New York State Workers' Compensation Board (WCB),https://www.wcb.ny.gov/content/main/hcpp/FeeSchedules.jsp,"Brand drugs: AWP minus 12% plus $4.00 dispensing fee; generic drugs: AWP minus 20% plus $5.00 dispensing fee (effective October 1 2019); subject to the state drug formulary's preferred/non-preferred/exempt classification",NY WCB,New York State Workers' Compensation Board,"Full and final settlements proceed under Workers' Compensation Law Section 32 as Waiver Agreements; the Board (or a designee) reviews the agreement administratively, issues provisional approval, allows a ten-day withdrawal period, then issues a formal decision; payment is due within ten days of the formal decision.",New York,"New York's Medical Treatment Guidelines (MTGs, mandatory since December 2010 and last updated May 2022) set evidence-based treatment standards for major body regions; treatment outside MTG parameters requires prior authorization through the Board's OnBoard system, and this authorization history shapes what future treatment is demonstrably probable for WCMSA purposes.","New York's drug formulary (effective March 2022) classifies drugs as Phase A, Phase B, perioperative, or non-formulary; non-formulary drugs require prior authorization from the carrier, and any controlled substance or specialty drug projected in a WCMSA must be checked against current formulary status because reimbursability depends on the formulary classification.","Schedule Loss of Use (SLU) awards compensate permanent functional loss of scheduled extremities and are distinct from permanency classification cases; an SLU case can settle without a finding of total or partial disability, and the medical picture underlying an SLU settlement (including remaining treatment need) must still be fully captured in the WCMSA even though the indemnity structure differs from a classification case.",New York,Buffalo,Rochester,Yonkers,Syracuse,,Y,CONFIRMED,"https://www.wcb.ny.gov/content/main/hcpp/FeeSchedules.jsp; https://www.wcb.ny.gov/content/main/hcpp/PharmacyFeeSchedule.jsp; https://www.wcb.ny.gov/content/main/hcpp/DrugFormulary/overview.jsp; https://www.wcb.ny.gov/Section32/section32_waiver-agreements-guidance.jsp"
North Carolina,NC,north-carolina,NCIC Medical Fee Schedule,North Carolina Industrial Commission Medical Fee Schedule,North Carolina Industrial Commission,https://www.ic.nc.gov/ncic/pages/feesched.asp,95% of AWP per unit as of the date of dispensing (the lesser of that amount or the provider's contracted rate with the payor); original manufacturer NDC required on all billing; no closed formulary,North Carolina Industrial Commission,North Carolina Industrial Commission (Deputy Commissioner),"All compromise settlement agreements (called ""clinchers"") must be submitted to and approved by a Deputy Commissioner of the North Carolina Industrial Commission, who reviews for fairness and the best interest of all parties under NCIC Rule 502; the agreement must confirm that all medical expenses through the settlement date are addressed by the employer or carrier before approval is granted.",Atlanta,"The NCIC fee schedule is anchored to 1995 North Carolina Medicare values multiplied by service-category-specific factors (for example, 1.58 for general medicine CPT codes, 2.05 for evaluation and management codes 99201-99215); because the base year is 1995, the resulting NCIC rate may be significantly higher or lower than current Medicare rates depending on the CPT code, and a WCMSA must use the applicable NCIC maximum.","Where neither the NCIC fee schedule nor a contracted rate applies, the reimbursement ceiling is the provider's usual, customary, and reasonable charge under G.S. § 97-26; this means some services for which the NCIC schedule is silent may be projected at UCR levels, and the WCMSA must identify which rate basis applies to each projected service.","North Carolina uses a Form 26A agreement to memorialize accepted claims and compensation amounts, and a separate compromise settlement agreement (clincher) to close future medical; a settlement that closes only indemnity while leaving medical open is procedurally distinct from a full clincher, and the WCMSA is only relevant to closures that include future medical.",Charlotte,Raleigh,Greensboro,Durham,Winston-Salem,,N,CONFIRMED,"https://www.ic.nc.gov/ncic/pages/feesched.asp; https://www.ic.nc.gov/ncic/pages/statute/97-26.htm; https://www.ic.nc.gov/ncic/pages/R502.HTM"
North Dakota,ND,north-dakota,WSI Medical Fee Schedule,"North Dakota Workforce Safety & Insurance Fee Schedule Guidelines (Medical Provider, Pharmacy, Inpatient Hospital, and DME schedules)",North Dakota Workforce Safety & Insurance (WSI),https://www.workforcesafety.com/medical-providers/billing-payment,WAC plus 8% plus a per-item dispensing fee of $4.00 (or UCR whichever is lesser); pharmacy fee schedule based on Wolters Kluwer Medi-Span Electronic Drug File WAC data; WSI contracts with LucyRx as pharmacy benefit manager,WSI,North Dakota Workforce Safety & Insurance,"WSI is the sole insurer and the sole settlement authority in North Dakota's monopolistic system; there is no private insurer counterparty, so all settlement negotiations are conducted directly with WSI, which may separately close a disability claim while holding medical benefits open, or may convert benefits to a structured arrangement.",Denver,"North Dakota's monopolistic fund structure means WSI simultaneously administers claims, sets reimbursement rates, and functions as the settlement counterparty; a WCMSA clinician must project future care costs against WSI's own fee schedule, because no private-insurer variation applies.","WSI uses ODG by MCG (formerly Official Disability Guidelines) as its evidence-based medical treatment guideline framework; projected future treatment that falls outside ODG benchmarks requires prior authorization, and the WCMSA must account for whether WSI's utilization review process would support projected treatment.","A claim is presumed closed if WSI has not paid any benefit for four years; this dormancy rule can affect how ongoing medical benefit entitlement is established in a WCMSA settlement, and active treatment records should be maintained to avoid inadvertent claim closure.",Fargo,Bismarck,Grand Forks,Minot,West Fargo,,Y,CONFIRMED,"https://www.workforcesafety.com/medical-providers/pharmacy-services/fee-schedule; https://www.workforcesafety.com/news/updated-fee-schedules-effective-january-1-2025; https://ndlegis.gov/cencode/t65c01.pdf"
Ohio,OH,ohio,Ohio BWC Fee Schedule,Ohio Bureau of Workers' Compensation Medical Fee Schedule (administered under Ohio Administrative Code Chapter 4123-6),Ohio Bureau of Workers' Compensation (BWC),https://info.bwc.ohio.gov/for-providers/billing-and-reimbursement,AWP minus 15% plus $3.50 dispensing fee; 2025 proposed rule amendments would cap non-sterile compound reimbursement at $100 and replace fixed compound dispensing fees with time-based fees,Ohio BWC / Industrial Commission,Ohio Bureau of Workers' Compensation (BWC) with Industrial Commission of Ohio (IC) review,"State-fund settlements require BWC approval via Form C-240, followed by a 30-day IC review window during which the IC may disapprove only for clear unfairness; if the IC does not act, the settlement is approved by operation of law, after which a mandatory 30-day cooling-off period runs before finality.",Chicago,"Ohio's WC claims are allowed or denied on a condition-by-condition basis, and BWC's reimbursement is limited to the allowed conditions in the claim; a WCMSA must address only conditions that have been formally allowed, and any additional conditions requested via C-9 but not yet allowed are not includable until and unless BWC allows them.","Ohio BWC is the sole insurer for non-self-insured employers (monopolistic state-fund jurisdiction); private WC carriers do not operate in this market, so all state-fund claim settlement procedures, fee schedule rates, and formulary rules flow through BWC rather than commercial insurer programs.","Ohio BWC maintains a fee lookup tool (searchable by CPT code) and publishes separate fee schedules for physician services, hospital outpatient (OPPS-based), and ambulatory surgery centers; the applicable schedule depends on the setting of care, so projecting future treatment costs in a WCMSA requires matching each projected service to the correct Ohio BWC fee schedule tier.",Columbus,Cleveland,Cincinnati,Toledo,Akron,,Y,CONFIRMED,"https://info.bwc.ohio.gov/for-providers/billing-and-reimbursement; https://www.bwc.ohio.gov/provider/services/feelookup/; https://www.bwc.ohio.gov/worker/programs/claimsettlement/CSDescription.asp"
Oklahoma,OK,oklahoma,WCC Medical Fee Schedule,Oklahoma Workers' Compensation Commission Schedule of Medical and Hospital Fees,Oklahoma Workers' Compensation Commission (WCC),https://www.wcc.ok.gov/medical,90% of AWP plus $5.00 dispensing fee per prescription; closed formulary adopted by rule under Title 85A § 50; non-formulary drugs require preauthorization with a documented plan of care; generic equivalent required when available,WCC,Oklahoma Workers' Compensation Commission,"Joint petition settlements are filed with the WCC and approved by a Commissioner; a Benefit Review Officer who conducted the preliminary conference on a claim may not approve the joint petition for that same claim.",Dallas,"Oklahoma requires impairment ratings for permanent partial disability to use the AMA Guides Sixth Edition, which produces different rating values than states still using older editions; the Sixth Edition methodology is the baseline for understanding the disability scope in any WCMSA.","Oklahoma's closed formulary (adopted under 85A § 50, implemented via WCC rules and ODG) requires preauthorization for drugs not on the formulary; every drug projected in a WCMSA must be checked against formulary status, because non-formulary projection without a documented clinical exception is contestable.","ODG Treatment in Workers' Compensation is the statutory evidence-based treatment standard in Oklahoma (85A § 16); projected future treatment that falls outside ODG parameters requires additional clinical support to withstand scrutiny.",Oklahoma City,Tulsa,Norman,Broken Arrow,Edmond,"Vasquez v. Dillard's, Inc., 2016 OK 89, 381 P.3d 768",N,CONFIRMED,"https://www.wcc.ok.gov/medical; https://law.justia.com/codes/oklahoma/title-85a/section-85a-50/; https://law.justia.com/codes/oklahoma/title-85a/section-85a-115/"
